source,brand,description,original_price,final_price
babyartikel,Hauck,Hauck Bouncer 2in1 Premium (verstellbarer Neugeborenenaufsatz & Wippe) für Alpha & Beta Hochstuhl - Jersey Charcoal,89.9,89.9
babyartikel,Hauck,Hauck Bouncer 2in1 Premium (verstellbarer Neugeborenenaufsatz & Wippe) für Alpha & Beta Hochstuhl - Nordic Grey,89.9,89.9
babyartikel,Hauck,Hauck Alpha Plus Natur 5-tlg. XXL Newborn Set - Hochstuhl + 2in1 Neugeboreneneinsatz + Alpha Tray + Sitzpolster,229.6,179.99
babyartikel,Hauck,Hauck Alpha Plus Grau Newborn Set - 4-tlg. Hochstuhl + Aufsatz & Wippe Premium Jersey Charcoal + Sitzpolster,219.97,189.9
babyartikel,Hauck,Hauck Hochstuhl Alpha Natur - im Sparset inkl. Holz-Essbrett und Sitzkissen Nordic Grey,159.7,119.9
babyartikel,Hauck,Hauck Sitzpolster / Sitzverkleinerer - Deluxe für Alpha Hochstuhl - Grau,24.9,19.9
babyartikel,Hauck,Hauck Alpha Plus Walnut Newborn Set - 4-tlg. Hochstuhl + Neugeboreneneinsatz & Wippe Stretch Beige + Sitzpolster,149.97,129.99
babyartikel,Hauck,Hauck Hochstuhl & Babyliege ab Geburt - Grow Up Newborn Set (faltbar & klappbar) - Melange Grey,179.99,139.99
babyartikel,Hauck,"Hauck Beta Plus White Newborn Set - 5-tlg. Hochstuhl + Aufsatz & Wippe Premium, Essbrett, Sitzkissen - Jersey Charcoal",219.8,199.99
babyartikel,Hauck,Hauck Neugeborenenaufsatz & Wippe für Alpha Hochstuhl - Bouncer 2in1 - Hearts Grey,74.9,56.98
babyartikel,Hauck,Hauck Sitzverkleinerer für Alpha Hochstuhl - Select Line - Jersey Charcoal,39.9,34.9
babyartikel,Hauck,Hauck Alpha Tray - 2-teiliges Essbrett & Tisch für Alpha Hochstühle - Grey / Grau,54.9,39.99
babyartikel,Hauck,Hauck Essbrett & Tisch aus Holz für Alpha Hochstühle (Wooden Tray) - Natur,39.9,29.9
babyartikel,Hauck,Hauck Hochstuhl Alpha Plus Rose - im Sparset inkl. Sitzkissen Deluxe Grey - Rosa,119.9,89.9
babyartikel,Hauck,"Hauck Beta Plus White Newborn Set - 5-tlg. Hochstuhl + Aufsatz & Wippe Premium, Essbrett, Sitzkissen - Nordic Grey",199.99,199.99
babyartikel,Hauck,Hauck Hochstuhl Alpha Charcoal Selectline - im Sparset inkl. Holz-Essbrett und Sitzkissen Jersey Charcoal,189.7,129.9
babyartikel,Hauck,Hauck Alpha Plus Natur Newborn Set - 4-tlg. Hochstuhl + Aufsatz & Wippe Premium Jersey Charcoal + Sitzpolster,189.7,169.9
babyartikel,Hauck,Hauck Alpha Plus Grau Newborn Set - 4-tlg. Hochstuhl + Aufsatz & Wippe Premium Nordic Grey + Sitzpolster,194.7,169.9
babyartikel,Hauck,Hauck Hochstuhlauflage Deluxe - Nordic Grey,29.9,29.9
babyartikel,Hauck,Hauck Alpha Plus White Newborn Set - 4-tlg. Hochstuhl + Aufsatz & Wippe Premium Nordic Grey + Sitzpolster,194.7,169.9
babyartikel,Hauck,Hauck Alpha Plus Grau Newborn Set Deluxe - 4-tlg. Hochstuhl + 2in1 Neugeboreneneinsatz (verstellbar) + Sitzpolster,179.97,159.99
babyartikel,Hauck,Hauck Alpha Plus White Newborn Set - 4-tlg. Hochstuhl + Aufsatz & Wippe Premium Jersey Charcoal + Sitzpolster,179.9,179.9
babyartikel,Hauck,Hauck Alpha Plus Natur Newborn Set - 4-tlg. Hochstuhl + Aufsatz & Wippe Premium Nordic Grey + Sitzpolster,184.7,159.9
babyartikel,Hauck,Hauck Beta Plus Natur Newborn Set Deluxe - 5-tlg. Hochstuhl + 2in1 Neugeboreneneinsatz + Essbrett + Sitzpolster,179.99,169.99
babyartikel,Hauck,Hauck Hochstuhl Alpha Plus Move - mit Essbrett und Rollen - Natur,119.9,99.9
babyartikel,Hauck,Hauck Alpha Plus Natur Newborn Set - 4-tlg. Hochstuhl + Neugeboreneneinsatz & Wippe Stretch Beige + Sitzpolster,149.97,129.99
babyartikel,Hauck,Hauck Neugeborenenaufsatz & Wippe für Alpha Hochstuhl - Bouncer 2in1 - Hearts Beige,74.9,56.98
babyartikel,Hauck,Hauck Alpha Plus Weiß Newborn Set Deluxe - 4-tlg. Hochstuhl + 2in1 Neugeboreneneinsatz (verstellbar) + Sitzpolster,179.97,159.99
babyartikel,Hauck,Hauck Alpha Plus Grau XXL Newborn Set - Hochstuhl + 2in1 Aufsatz + Alpha Tray Essbrett + Zubehör - Jersey Charcoal,294.5,249.99
babyartikel,Hauck,Hauck Hochstuhl Beta Plus - Whitewashed Dots,109.99,109.99
babyartikel,Hauck,Hauck Hochstuhl Alpha Plus Grey - im Sparset inkl. Sitzkissen Jersey Charcoal - Grau,109.8,89.9
babyartikel,Hauck,"Hauck Beta Plus White Newborn Set - 5-tlg. Hochstuhl + Aufsatz & Wippe Deluxe, Essbrett, Sitzkissen - Melange Grey",189.99,189.99
babyartikel,Hauck,Hauck Hochstuhl Gamma Plus Set Natur - inkl. Essbrett und Sitzpolster Deluxe,114.8,84.99
babyartikel,Hauck,Hauck Alpha Plus Grey Newborn Set - 4-tlg. Hochstuhl + Neugeboreneneinsatz & Wippe Stretch Grey + Sitzpolster,159.97,139.99
babyartikel,Hauck,Hauck Hochstuhl Beta Plus - Natur Check,109.99,109.99
babyartikel,Hauck,Hauck Hochstuhl Gamma Plus - Natur,89.9,74.99
babyartikel,Hauck,Hauck Hochstuhl Alpha Plus Select - Charcoal / Dunkelgrau,119.9,119.9
babyartikel,Hauck,Hauck Hochstuhl Alpha Plus Natur - im Sparset inkl. Sitzkissen Nordic Grey,89.9,89.9
babyartikel,Hauck,Hauck Hochstuhlauflage Deluxe - Select Line - Jersey Charcoal,29.9,29.9
babyartikel,Hauck,"Hauck Beta Plus White Newborn Set - 5-tlg. Hochstuhl + Aufsatz & Wippe, Essbrett, Sitzkissen - Stretch Grey",169.99,169.99
babyartikel,Hauck,Hauck Hochstuhl Alpha Plus Grau - im Sparset inkl. Sitzkissen Nordic Grey,104.89,89.99
babyartikel,Hauck,Hauck Alpha Plus White Newborn Set - 4-tlg. Hochstuhl + Neugeboreneneinsatz & Wippe Stretch Grey + Sitzpolster,159.97,139.99
babyartikel,Hauck,Hauck Hochstuhl & Babyliege Sit'n Relax - Hearts,149.9,109.99
babyartikel,Hauck,Hauck Hochstuhl Alpha Plus Natur - im Sparset inkl. Sitzkissen Jersey Charcoal,99.8,84.99
babyartikel,Hauck,"Hauck Hochstuhl Alpha Plus Move Natur - im Sparset inkl. Essbrett, Sitzkissen Deluxe Beige und 2x Silikonteller",164.6,119.9
babyartikel,Hauck,Hauck Verstellbarer Neugeborenenaufsatz & Wippe für Alpha & Beta Hochstuhl - Bouncer 2in1 Deluxe - Melange Grey,79.99,79.99
babyartikel,Hauck,"Hauck Hochstuhl Beta Plus White - inkl. Essbrett, Sitzkissen und Rollen - Weiß",139.9,119.9
babyartikel,Hauck,Hauck Hochstuhl Alpha Plus - Rose,99.9,99.9
babyartikel,Hauck,Hauck Schutzbügel aus Holz für Alpha Plus Move Hochstuhl - Natur,24.9,19.99
babyartikel,Hauck,Hauck Alpha Plus Weiss XL Newborn Set - Hochstuhl + 2in1 Aufsatz + Alpha Tray Essbrett + Sitzauflage - Nordic Grey,249.6,199.99
babyartikel,Hauck,Hauck Alpha Plus Weiss XXL Newborn Set - Hochstuhl + 2in1 Aufsatz + Alpha Tray Essbrett + Zubehör - Jersey Charcoal,294.5,249.99
babyartikel,Hauck,Hauck Alpha Plus Grau XL Newborn Set - Hochstuhl + 2in1 Aufsatz + Alpha Tray Essbrett + Sitzauflage - Nordic Grey,249.6,199.99
babyartikel,Hauck,Hauck Alpha Plus Natur XXL Newborn Set - Hochstuhl + 2in1 Aufsatz + Alpha Tray Essbrett + Zubehör - Jersey Charcoal,284.5,239.99
babyartikel,Hauck,Hauck Hochstuhl Alpha Plus White - im Sparset inkl. Sitzkissen Nordic Grey - Weiß,104.8,84.99
babyartikel,Hauck,Hauck Hochstuhl Alpha Plus White - im Sparset inkl. Sitzkissen Jersey Charcoal - Weiß,109.8,89.99
babyartikel,Hauck,Hauck Alpha Plus Natur XL Newborn Set - Hochstuhl + 2in1 Aufsatz + Alpha Tray Essbrett + Sitzauflage - Nordic Grey,239.6,199.99
babyartikel,Hauck,Hauck Hochstuhl Alpha Plus Rose - im Sparset inkl. Sitzkissen Jersey Charcoal - Rosa,109.8,89.99
babyartikel,Hauck,"Hauck Alpha Move Natur Newborn Set - 5-tlg. Hochstuhl + Aufsatz & Wippe, Essbrett, Sitzkissen - Stretch Beige",214.7,159.9
babyartikel,Hauck,Hauck Alpha Tray - 2-teiliges Essbrett & Tisch für Alpha Hochstühle,54.9,44.9
babyartikel,Hauck,Hauck Hochstuhl & Babyliege ab Geburt - Sitn Care Newborn Set (faltbar & klappbar) - Stretch Grey,199.99,109.99
babyartikel,Hauck,Hauck Verstellbarer Neugeborenenaufsatz & Wippe für Alpha & Beta Hochstuhl - Bouncer 2in1 Deluxe - Sand,79.99,79.99
babyartikel,Hauck,"Hauck Sitn Relax 3in1 - Hochstuhl ab der Geburt, Babyliege und Wippe - Nordic Grey",209.9,159.9
babyartikel,Hauck,"Hauck Hochstuhl Alpha Move Natur - im Sparset inkl. Essbrett, Sitzkissen Jersey Charcoal und 2x Silikonteller",174.6,129.9
babyartikel,Hauck,Hauck Sitzpolster / Sitzverkleinerer - Deluxe für Alpha Hochstuhl - Beige,24.9,19.9
babyartikel,Hauck,Hauck Alpha Plus Walnut Newborn Set Deluxe - 4-tlg. Hochstuhl + 2in1 Neugeboreneneinsatz (verstellbar) + Sitzpolster,169.97,149.99
babyartikel,Hauck,"Hauck Alpha Move Natur Newborn Set - 5-tlg. Hochstuhl + Aufsatz & Wippe Deluxe, Essbrett, Sitzkissen - Sand",224.7,179.9
babyartikel,Hauck,Hauck Beta Plus Newborn Set - Hochstuhl + Neugeborenenaufsatz & Babywippe - White-Washed Dots,159.99,149.99
babyartikel,Hauck,"Hauck Alpha Move Natur Newborn Set - 5-tlg. Hochstuhl + Aufsatz & Wippe Premium, Essbrett, Sitzkissen - Jersey Charcoal",239.7,199.9
babyartikel,Hauck,"Hauck Alpha Move Natur Newborn Set - 5-tlg. Hochstuhl + Aufsatz & Wippe Premium, Essbrett, Sitzkissen - Nordic Grey",239.7,189.9
babyartikel,Hauck,Hauck Alpha Plus Natur - Newborn Set - Hochstuhl + Neugeboreneneinsatz & Wippe,119.99,119.99
babyartikel,Fillikid,Fillikid Hochstuhl Aron - Punkte - Grau,99.99,89.99
babyartikel,Hauck,Hauck Hochstuhl Alpha Plus - Grey,99.9,99.9
babyartikel,Hauck,Hauck Beta Plus Natur Newborn Set - 5-tlg. Hochstuhl + Neugeboreneneinsatz & Wippe Stretch Beige + Essbrett + Sitzpolster,154.99,154.99
babyartikel,Hauck,Hauck Hochstuhl & Babyliege ab Geburt - Sit'n Relax Newborn Set - Pooh Cuddles,169.99,149.99
babyartikel,Hauck,Hauck Hochstuhl & Babyliege ab Geburt - Sit'n Relax Newborn Set - Friend,149.9,129.99
babyartikel,Hauck,Hauck Neugeborenenaufsatz & Wippe für Alpha Hochstuhl - Bouncer 2in1 - Stretch Grey,69.9,69.9
babyartikel,Hauck,Hauck Hochstuhl Sitn Fold - Circles Blue,79.99,59.99
babyartikel,Hauck,Hauck Alpha Plus Grau - Newborn Set - Hochstuhl + Neugeboreneneinsatz & Wippe,129.99,129.99
babyartikel,Hauck,Hauck Neugeborenenaufsatz & Wippe für Alpha Hochstuhl - Bouncer 2in1 - Stretch Beige,69.9,69.9
babyartikel,Hauck,Hauck Alpha Plus Natur Newborn Set Deluxe - 4-tlg. Hochstuhl + 2in1 Neugeboreneneinsatz (verstellbar) + Sitzpolster,169.97,149.99
babyartikel,Hauck,Hauck Hochstuhl Alpha Plus - White,99.9,99.9
babyartikel,Hauck,Hauck Alpha Plus Weiß - Newborn Set - Hochstuhl + Neugeboreneneinsatz & Wippe,129.99,129.99
babyartikel,Hauck,Hauck Alpha Plus Walnut Newborn Set - 3-tlg. Hochstuhl + Neugeboreneneinsatz & Wippe Stretch Beige,119.99,119.99
babyartikel,Hauck,Hauck Alpha Plus Natur Newborn Set - 3-tlg. Hochstuhl + Neugeboreneneinsatz & Wippe Stretch Beige,119.99,119.99
babyartikel,Hauck,Hauck Alpha Plus White Newborn Set - 3-tlg. Hochstuhl + Neugeboreneneinsatz & Wippe Stretch Grey,129.99,129.99
babyartikel,Hauck,Hauck Alpha Plus Grey Newborn Set - 3-tlg. Hochstuhl + Neugeboreneneinsatz & Wippe Stretch Grey,129.99,129.99
babyartikel,Chicco,Chicco Hochstuhlspielzeug Willy die Windmühle,9.99,9.99
babyartikel,Hauck,Hauck Hochstuhl Alpha Plus - Natur,89.9,89.9
babyartikel,Hauck,Hauck Hochstuhl Sitn Relax - Multi Dots Sand,179.99,129.99
babyartikel,Hauck,Hauck Hochstuhlauflage Deluxe - Pooh Cuddles,19.99,19.99
babyartikel,Chicco,Chicco Hochstuhlspielzeug Phill die Raupe,16.99,16.99
babyartikel,Hauck,Hauck Essbrett & Tisch aus Holz für Alpha Hochstühle (Wooden Tray) - Charcoal,39.9,29.9
babyartikel,Hauck,Hauck Beta Plus Whitewashed Newborn Set - 5-tlg. Hochstuhl + Neugeboreneneinsatz & Wippe Stretch Grey + Essbrett + Sitzpolster,159.99,159.99
babyartikel,Hauck,Hauck Hochstuhlauflage & Sitzverkleinerer - Disney Deluxe - Mickey Grey,29.99,26.99
babyartikel,Hauck,Hauck Beta Plus Whitewashed Newborn Set Deluxe - 5-tlg. Hochstuhl + 2in1 Neugeboreneneinsatz + Essbrett + Sitzpolster,179.99,179.99
babyartikel,Hauck,Hauck Hochstuhl Alpha Plus - Walnut,89.9,89.9
babyartikel,LaLoona,LaLoona Hochstuhl Sitzkissen für Stokke Tripp Trapp - Grau,24.99,24.99
babyartikel,Hauck,Hauck Sitzverkleinerer für Alpha Hochstuhl - Comfort Line - Stretch Grey,39.9,34.9
babyartikel,Roba,Roba Sitzverkleinerer für Roba-Kombi-Hochstuhl - Adam & Eule,19.9,14.99
babyartikel,Roba,Roba Treppen-Hochstuhl Sit Up III - Natur,89.9,64.99
babyartikel,Fillikid,Fillikid Faltbarer Tischsitz inkl. Tasche - Melange Grau,29.99,29.99
babyartikel,joie,joie Hochstuhl Mimzy Snacker - Alphabet,79.95,79.95
babyartikel,Roba,Roba Universal-Sitzverkleinerer - Little Stars - Grau,29.9,19.99
babyartikel,Roba,Roba Sitzerhöhung Boostersitz aufblasbar - Dunkelblau,34.9,24.99
babyartikel,Fillikid,Fillikid Hochstuhl & Kinderstuhl Paul inkl. Essbrett - Sterne Grau,99.99,99.99
babyartikel,joie,joie Hochstuhl Mimzy 2in1 - Tile,119.95,99.95
babyartikel,Fillikid,Fillikid Hochstuhl & Kinderstuhl Paul inkl. Essbrett - Zick Zack,99.99,99.99
babyartikel,playgro,playgro Hochstuhl-Spielzeug mit Saugfuß - Drehrassel,13.99,11.99
babyartikel,ABC Design,ABC Design Hopper Set - Track,29.9,24.9
babyartikel,joie,joie Hochstuhl Mimzy 2in1 - Logan,119.95,109.95
babyartikel,Hauck,Hauck Hochstuhlauflage Deluxe - Stretch Grey,24.9,19.99
babyartikel,Chicco,Chicco Tablett & Sitzbezug Mahlzeitset für Baby Hug 4 in 1 Air - Neutral,49.9,49.9
babyartikel,ABC Design,ABC Design Hopper Set - Bean,29.9,24.9
babyartikel,Roba,Roba Sitzverkleinerer für Sit Up III + Super Maxi - Jumbotwins,19.9,14.99
babyartikel,Roba,Roba Sitzverkleinerer für Sit Up III + Super Maxi - Adam & Eule,19.9,14.99
babyartikel,Schardt,Schardt Treppen-Hochstuhl Domino inkl. Spielbrett und Sitzverkleinerer - Circle Star - Grey,129.9,79.99
babyartikel,Chicco,Chicco Hochstuhl und Babyliege Polly Magic Relax - Cocoa,159.99,159.99
babyartikel,Schardt,Schardt Hochstuhl Holly Natur inkl. Sitzkissen - Rosa,139.0,84.96
babyartikel,Hauck,Hauck Hochstuhlauflage & Sitzverkleinerer - Disney Deluxe - Minnie Grey,29.99,23.99
babyartikel,Schardt,Schardt Kombi-Hochstuhl X-Tra II Buche Natur inkl. Sitzverkleinerer - Sternchen Grau,72.9,54.99
babyartikel,Hauck,Hauck Hochstuhlauflage & Sitzverkleinerer - Disney Deluxe - Winnie Pooh Grey,29.99,23.99
babyartikel,Hauck,Hauck Hochstuhlauflage Deluxe - Multicolor Beige,19.99,19.99
babyartikel,ABC Design,ABC Design Schutzbügel Hopper - White,44.9,34.9
babyartikel,Hauck,Hauck Hochstuhlauflage Deluxe - Sweety,24.9,19.99
babyartikel,Roba,Roba Treppen-Hochstuhl Sit Up Click mit Essbrett - Natur,109.9,84.99
babyartikel,Pinolino,Pinolino Kombi-Hochstuhl Lene,89.9,79.99
babyartikel,Hauck,"Hauck Sitn Relax 3in1 - Hochstuhl ab der Geburt, Babyliege und Wippe - Stretch Grey",209.9,159.99
babyartikel,ABC Design,ABC Design Hopper Set - Camel,29.9,19.99
babyartikel,Chicco,"Chicco Stubenwagen, Hochstuhl, Sessel Baby Hug 4 in 1 Air - Stone",249.0,219.99
babyartikel,Hauck,Hauck Hochstuhl Sitn Fold - Pooh Cuddles,79.99,79.99
babyartikel,Babymoov,Babymoov Sitzerhöhung Up & Go - Grey,42.99,42.99
babyartikel,Hauck,Hauck Hochstuhlauflage Deluxe - Teddy Grey,24.9,19.99
babyartikel,ABC Design,ABC Design Hopper Set - Coal,29.9,16.99
babyartikel,Hauck,Hauck Hochstuhlauflage Deluxe - Melange Charcoal,24.9,17.99
babyartikel,Hauck,Hauck Hochstuhlauflage Deluxe - Stretch Rose,24.9,19.9
babyartikel,Hauck,Hauck Hochstuhlauflage Deluxe - Stretch Beige,24.9,19.99
babyartikel,Chicco,Chicco Hochstuhl und Babyliege Polly Magic Relax - Graphite,179.0,164.99
